{
  "schema_version": "signal-quality.v1",
  "session_id": "7e3c75ed-2dc0-5bd5-974b-8f29a9fddd61",
  "data_source": "replay",
  "replay_origin": "synthetic",
  "duration_ms": 1000.0,
  "policy": {
    "version": "quality-policy.v1",
    "maximum_gap_us": 100000,
    "minimum_valid_duration_us": 1000000,
    "minimum_coverage": 0.8,
    "minimum_valid_samples": 2
  },
  "capabilities": {
    "gaze": {
      "available": true,
      "reason": null
    },
    "pupil_diameter": {
      "available": false,
      "reason": "not_exposed_by_runtime"
    },
    "eyelid_openness": {
      "available": false,
      "reason": "not_exposed_by_runtime"
    },
    "confidence_informative": false
  },
  "quality": {
    "status": "usable",
    "valid_coverage": 1.0,
    "valid_duration_ms": 1000.0,
    "gap_duration_ms": 0.0,
    "longest_gap_ms": 0.0,
    "reasons": [],
    "counts": {
      "input": 11,
      "accepted": 11,
      "valid_gaze": 11,
      "invalid_gaze": 0,
      "duplicate_timestamps": 0,
      "out_of_order_timestamps": 0,
      "out_of_bounds_timestamps": 0
    }
  }
}
