{
  "schema_version": "signal-quality.v1",
  "session_id": "a7acb0d6-7eb3-533c-aa4e-2f0d5f2d507a",
  "data_source": "replay",
  "replay_origin": "synthetic",
  "duration_ms": 1000.0,
  "policy": {
    "version": "quality-policy.v1",
    "maximum_gap_us": 100000,
    "minimum_valid_duration_us": 1000000,
    "minimum_coverage": 0.8,
    "minimum_valid_samples": 2
  },
  "capabilities": {
    "gaze": {
      "available": true,
      "reason": null
    },
    "pupil_diameter": {
      "available": false,
      "reason": "not_exposed_by_runtime"
    },
    "eyelid_openness": {
      "available": false,
      "reason": "not_exposed_by_runtime"
    },
    "confidence_informative": false
  },
  "quality": {
    "status": "insufficient_data",
    "valid_coverage": 0.4,
    "valid_duration_ms": 400.0,
    "gap_duration_ms": 600.0,
    "longest_gap_ms": 600.0,
    "reasons": [
      "too_short",
      "low_coverage"
    ],
    "counts": {
      "input": 6,
      "accepted": 6,
      "valid_gaze": 6,
      "invalid_gaze": 0,
      "duplicate_timestamps": 0,
      "out_of_order_timestamps": 0,
      "out_of_bounds_timestamps": 0
    }
  }
}
